{
  "index_id": "EVIDENCE-SONNY-20260201-065513",
  "run_id": "RUN-SONNY-20260201-065431",
  "plan_id": "PLAN-SONNY-20260201-065431",
  "generated_at": "2026-02-01T06:55:13.835974Z",
  "base_path": "D:\\projects\\becca-kernel\\governance\\runs\\RUN-SONNY-20260201-065431",
  "summary": {
    "total_items": 11,
    "total_size_bytes": 40259,
    "by_type": {
      "secrets_findings": 4,
      "scan_profile": 2,
      "audit_trail": 3,
      "config_snapshot": 1,
      "log_extract": 1
    },
    "by_source_task": {
      "T001": 3,
      "T002": 8
    }
  },
  "evidence": [
    {
      "evidence_id": "E0001",
      "path": "bq_executor\\evidence\\SECRET_FINDINGS.json",
      "type": "secrets_findings",
      "format": "json",
      "description": "SECRET_FINDINGS from secrets_scanner",
      "source_task": "T001",
      "source_tool": "secrets_scanner",
      "generated_at": "2026-02-01T06:54:47.043629Z",
      "size_bytes": 454,
      "hash": "sha256:82388f3f24b6e7e6628f5efdaadb2f4075f61902860039191bc8766b18eb844b",
      "linked_risks": [],
      "retention": "run_lifetime"
    },
    {
      "evidence_id": "E0002",
      "path": "bq_executor\\evidence\\SECRET_FINDINGS.md",
      "type": "secrets_findings",
      "format": "md",
      "description": "SECRET_FINDINGS from secrets_scanner",
      "source_task": "T001",
      "source_tool": "secrets_scanner",
      "generated_at": "2026-02-01T06:54:47.043629Z",
      "size_bytes": 968,
      "hash": "sha256:d330e4fc6482a8e58422478c2575230e99076531a52364320b97d5b384c42496",
      "linked_risks": [],
      "retention": "run_lifetime"
    },
    {
      "evidence_id": "E0003",
      "path": "bq_executor\\evidence\\SCAN_PROFILE.json",
      "type": "scan_profile",
      "format": "json",
      "description": "SCAN_PROFILE from secrets_scanner",
      "source_task": "T001",
      "source_tool": "secrets_scanner",
      "generated_at": "2026-02-01T06:54:47.043629Z",
      "size_bytes": 804,
      "hash": "sha256:2968047f8dc20c4275b094760e51591c615a5a24037cc36db370039353a1798c",
      "linked_risks": [],
      "retention": "run_lifetime"
    },
    {
      "evidence_id": "E0004",
      "path": "tool_inspector\\evidence\\project_structure.json",
      "type": "audit_trail",
      "format": "json",
      "description": "project_structure from inspector",
      "source_task": "T002",
      "source_tool": "inspector",
      "generated_at": "2026-02-01T06:55:13.782247Z",
      "size_bytes": 3508,
      "hash": "sha256:83e06bf54c07aa48f5b430040001e2d8c87bbf5aacc860fad1b504f0cd33f8ea",
      "linked_risks": [],
      "retention": "run_lifetime"
    },
    {
      "evidence_id": "E0005",
      "path": "tool_inspector\\evidence\\grep_results.json",
      "type": "audit_trail",
      "format": "json",
      "description": "grep_results from inspector",
      "source_task": "T002",
      "source_tool": "inspector",
      "generated_at": "2026-02-01T06:55:13.782247Z",
      "size_bytes": 3795,
      "hash": "sha256:0ede3dfcebc0b12addc317f3362e25315620dc5a96c2a49e298765d84b51a820",
      "linked_risks": [],
      "retention": "run_lifetime"
    },
    {
      "evidence_id": "E0006",
      "path": "tool_inspector\\evidence\\config_files.json",
      "type": "config_snapshot",
      "format": "json",
      "description": "config_files from inspector",
      "source_task": "T002",
      "source_tool": "inspector",
      "generated_at": "2026-02-01T06:55:13.782247Z",
      "size_bytes": 1918,
      "hash": "sha256:24fcfc7e7ba2737516a92347748f6567ec1a8fed75c217e3749b10914dba6fdd",
      "linked_risks": [],
      "retention": "run_lifetime"
    },
    {
      "evidence_id": "E0007",
      "path": "tool_inspector\\evidence\\error_patterns.json",
      "type": "audit_trail",
      "format": "json",
      "description": "error_patterns from inspector",
      "source_task": "T002",
      "source_tool": "inspector",
      "generated_at": "2026-02-01T06:55:13.782247Z",
      "size_bytes": 15306,
      "hash": "sha256:d4f7ee1736816702f8864b18e317932e9615f12872504e13c1a49d042236c4d0",
      "linked_risks": [],
      "retention": "run_lifetime"
    },
    {
      "evidence_id": "E0008",
      "path": "tool_inspector\\evidence\\SECRET_FINDINGS.json",
      "type": "secrets_findings",
      "format": "json",
      "description": "SECRET_FINDINGS from inspector",
      "source_task": "T002",
      "source_tool": "inspector",
      "generated_at": "2026-02-01T06:55:13.782247Z",
      "size_bytes": 454,
      "hash": "sha256:fed69f6d09e1710f96a452eea8f4b756697d74bde6074f0215f66a08a08745f5",
      "linked_risks": [],
      "retention": "run_lifetime"
    },
    {
      "evidence_id": "E0009",
      "path": "tool_inspector\\evidence\\SECRET_FINDINGS.md",
      "type": "secrets_findings",
      "format": "md",
      "description": "SECRET_FINDINGS from inspector",
      "source_task": "T002",
      "source_tool": "inspector",
      "generated_at": "2026-02-01T06:55:13.782247Z",
      "size_bytes": 968,
      "hash": "sha256:abcb8755ecc9d92b9eee450b5ba0f937c97e786c191ce30f9cb444b1a4e5718e",
      "linked_risks": [],
      "retention": "run_lifetime"
    },
    {
      "evidence_id": "E0010",
      "path": "tool_inspector\\evidence\\SCAN_PROFILE.json",
      "type": "scan_profile",
      "format": "json",
      "description": "SCAN_PROFILE from inspector",
      "source_task": "T002",
      "source_tool": "inspector",
      "generated_at": "2026-02-01T06:55:13.782247Z",
      "size_bytes": 801,
      "hash": "sha256:90aa0c606c2fe7af0d5f10000b5f8d5ccca2c449c1bcd8cce28ad4a361617cef",
      "linked_risks": [],
      "retention": "run_lifetime"
    },
    {
      "evidence_id": "E0011",
      "path": "tool_inspector\\evidence\\audit_log.json",
      "type": "log_extract",
      "format": "json",
      "description": "audit_log from inspector",
      "source_task": "T002",
      "source_tool": "inspector",
      "generated_at": "2026-02-01T06:55:13.782247Z",
      "size_bytes": 11283,
      "hash": "sha256:5501683c7fc8a80b86f5f639360e00f327e381cb75b601da9a3da22d56208e5d",
      "linked_risks": [],
      "retention": "run_lifetime"
    }
  ]
}