{
  "index_id": "EVIDENCE-SONNY-20260201-072539",
  "run_id": "RUN-SONNY-20260201-072508",
  "plan_id": "PLAN-SONNY-20260201-072508",
  "generated_at": "2026-02-01T07:25:39.596872Z",
  "base_path": "D:\\projects\\becca-kernel\\governance\\runs\\RUN-SONNY-20260201-072508",
  "summary": {
    "total_items": 11,
    "total_size_bytes": 40258,
    "by_type": {
      "secrets_findings": 4,
      "scan_profile": 2,
      "audit_trail": 3,
      "config_snapshot": 1,
      "log_extract": 1
    },
    "by_source_task": {
      "T001": 3,
      "T002": 8
    }
  },
  "evidence": [
    {
      "evidence_id": "E0001",
      "path": "bq_executor\\evidence\\SECRET_FINDINGS.json",
      "type": "secrets_findings",
      "format": "json",
      "description": "SECRET_FINDINGS from secrets_scanner",
      "source_task": "T001",
      "source_tool": "secrets_scanner",
      "generated_at": "2026-02-01T07:25:24.165168Z",
      "size_bytes": 454,
      "hash": "sha256:fd9ab0ca81536f5820d0145db32e83b6c3cb7518fd7c3ff96bf8a7a3a82a9635",
      "linked_risks": [],
      "retention": "run_lifetime"
    },
    {
      "evidence_id": "E0002",
      "path": "bq_executor\\evidence\\SECRET_FINDINGS.md",
      "type": "secrets_findings",
      "format": "md",
      "description": "SECRET_FINDINGS from secrets_scanner",
      "source_task": "T001",
      "source_tool": "secrets_scanner",
      "generated_at": "2026-02-01T07:25:24.165168Z",
      "size_bytes": 968,
      "hash": "sha256:df4fa76a8635f639125543e246919c8c2533a9d0e6a7e6a6e00597bbbbf4c96e",
      "linked_risks": [],
      "retention": "run_lifetime"
    },
    {
      "evidence_id": "E0003",
      "path": "bq_executor\\evidence\\SCAN_PROFILE.json",
      "type": "scan_profile",
      "format": "json",
      "description": "SCAN_PROFILE from secrets_scanner",
      "source_task": "T001",
      "source_tool": "secrets_scanner",
      "generated_at": "2026-02-01T07:25:24.165168Z",
      "size_bytes": 801,
      "hash": "sha256:e1cbb54c0ef84486987af72561e6d08f82d2bf70498dd945ab8854dc6514bf0e",
      "linked_risks": [],
      "retention": "run_lifetime"
    },
    {
      "evidence_id": "E0004",
      "path": "tool_inspector\\evidence\\project_structure.json",
      "type": "audit_trail",
      "format": "json",
      "description": "project_structure from inspector",
      "source_task": "T002",
      "source_tool": "inspector",
      "generated_at": "2026-02-01T07:25:39.546748Z",
      "size_bytes": 3508,
      "hash": "sha256:e4184dc4236c5b7a9404470bef5a946a9772ea27817a6e3ebe3fe62e0097865c",
      "linked_risks": [],
      "retention": "run_lifetime"
    },
    {
      "evidence_id": "E0005",
      "path": "tool_inspector\\evidence\\grep_results.json",
      "type": "audit_trail",
      "format": "json",
      "description": "grep_results from inspector",
      "source_task": "T002",
      "source_tool": "inspector",
      "generated_at": "2026-02-01T07:25:39.546748Z",
      "size_bytes": 3795,
      "hash": "sha256:9188852307d3ed43c899310aa1237e376aaec716e973ab5bd22cf52549686531",
      "linked_risks": [],
      "retention": "run_lifetime"
    },
    {
      "evidence_id": "E0006",
      "path": "tool_inspector\\evidence\\config_files.json",
      "type": "config_snapshot",
      "format": "json",
      "description": "config_files from inspector",
      "source_task": "T002",
      "source_tool": "inspector",
      "generated_at": "2026-02-01T07:25:39.546748Z",
      "size_bytes": 1918,
      "hash": "sha256:24fcfc7e7ba2737516a92347748f6567ec1a8fed75c217e3749b10914dba6fdd",
      "linked_risks": [],
      "retention": "run_lifetime"
    },
    {
      "evidence_id": "E0007",
      "path": "tool_inspector\\evidence\\error_patterns.json",
      "type": "audit_trail",
      "format": "json",
      "description": "error_patterns from inspector",
      "source_task": "T002",
      "source_tool": "inspector",
      "generated_at": "2026-02-01T07:25:39.546748Z",
      "size_bytes": 15306,
      "hash": "sha256:d4f7ee1736816702f8864b18e317932e9615f12872504e13c1a49d042236c4d0",
      "linked_risks": [],
      "retention": "run_lifetime"
    },
    {
      "evidence_id": "E0008",
      "path": "tool_inspector\\evidence\\SECRET_FINDINGS.json",
      "type": "secrets_findings",
      "format": "json",
      "description": "SECRET_FINDINGS from inspector",
      "source_task": "T002",
      "source_tool": "inspector",
      "generated_at": "2026-02-01T07:25:39.546748Z",
      "size_bytes": 454,
      "hash": "sha256:b7638630d1c38ebace09fe9088ed5c65cdf2954a8c588cefd7cfccecf42cd759",
      "linked_risks": [],
      "retention": "run_lifetime"
    },
    {
      "evidence_id": "E0009",
      "path": "tool_inspector\\evidence\\SECRET_FINDINGS.md",
      "type": "secrets_findings",
      "format": "md",
      "description": "SECRET_FINDINGS from inspector",
      "source_task": "T002",
      "source_tool": "inspector",
      "generated_at": "2026-02-01T07:25:39.546748Z",
      "size_bytes": 968,
      "hash": "sha256:899005829640016fabc6f8be03d56647dc2ea905c4bd32816ca093719a3ccb75",
      "linked_risks": [],
      "retention": "run_lifetime"
    },
    {
      "evidence_id": "E0010",
      "path": "tool_inspector\\evidence\\SCAN_PROFILE.json",
      "type": "scan_profile",
      "format": "json",
      "description": "SCAN_PROFILE from inspector",
      "source_task": "T002",
      "source_tool": "inspector",
      "generated_at": "2026-02-01T07:25:39.546748Z",
      "size_bytes": 803,
      "hash": "sha256:3a0fdd902728bbf98198877cebd3db7630346daabd3669aa502732d22fee6f83",
      "linked_risks": [],
      "retention": "run_lifetime"
    },
    {
      "evidence_id": "E0011",
      "path": "tool_inspector\\evidence\\audit_log.json",
      "type": "log_extract",
      "format": "json",
      "description": "audit_log from inspector",
      "source_task": "T002",
      "source_tool": "inspector",
      "generated_at": "2026-02-01T07:25:39.546748Z",
      "size_bytes": 11283,
      "hash": "sha256:eea317dc9c8bf2c37b241f49d69bac472ee0be05338d845202339f86042ce95d",
      "linked_risks": [],
      "retention": "run_lifetime"
    }
  ]
}